train,stations
train_1,"[Den Helder, Alkmaar, Den Helder, Alkmaar, Castricum]"
train_2,"[Amsterdam Amstel, Amsterdam Centraal, Amsterdam Amstel, Amsterdam Zuid, Amsterdam Sloterdijk, Haarlem]"
train_3,"[Hoorn, Alkmaar, Hoorn]"
train_4,"[Leiden Centraal, Schiphol Airport, Amsterdam Zuid, Schiphol Airport, Leiden Centraal, Alphen a/d Rijn, Leiden Centraal, Alphen a/d Rijn, Gouda, Rotterdam Alexander]"
train_5,"[Den Helder, Alkmaar, Castricum, Beverwijk, Haarlem]"
train_6,"[Dordrecht, Rotterdam Centraal, Schiedam Centrum, Delft, Schiedam Centrum, Delft, Den Haag Centraal]"
train_7,"[Alkmaar, Den Helder, Alkmaar]"
score,5195.571428571429
